<?xml version="1.0" encoding="UTF-8"?>
<!DOCTYPE connections PUBLIC
  "-//Penrose/DTD Connections ${product.specification}//EN"
  "http://penrose.safehaus.org/dtd/connections.dtd">

<connections>

  <connection name="Active Directory">
    <adapter-name>LDAP</adapter-name>
    <parameter>
      <param-name>java.naming.provider.url</param-name>
      <param-value>ldap://localhost/</param-value>
    </parameter>
    <parameter>
      <param-name>java.naming.security.principal</param-name>
      <param-value>cn=Administrator,cn=Users,dc=Example,dc=com</param-value>
    </parameter>
    <parameter>
      <param-name>java.naming.security.credentials</param-name>
      <param-value>secret</param-value>
    </parameter>
  </connection>

</connections>
