<?xml version="1.0" encoding="UTF-8"?>
<!DOCTYPE connections PUBLIC
  "-//Penrose/DTD Connections ${product.specification}//EN"
  "http://penrose.safehaus.org/dtd/connections.dtd">

<connections>

  <connection name="NIS">
    <adapter-name>NIS</adapter-name>
    <parameter>
      <param-name>method</param-name>
      <param-value>local</param-value>
    </parameter>
    <parameter>
      <param-name>dir</param-name>
      <param-value>/etc</param-value>
    </parameter>
  </connection>

</connections>
