<?xml version="1.0" encoding="UTF-8"?>
<!DOCTYPE connections PUBLIC
  "-//Penrose/DTD Connections ${product.specification}//EN"
  "http://penrose.safehaus.org/dtd/connections.dtd">

<connections>

  <connection name="Database">
    <adapter-name>JDBC</adapter-name>
    <parameter>
      <param-name>driver</param-name>
      <param-value>org.hsqldb.jdbcDriver</param-value>
    </parameter>
    <parameter>
      <param-name>url</param-name>
      <param-value>jdbc:hsqldb:file:partitions/join/db/example</param-value>
    </parameter>
    <parameter>
      <param-name>user</param-name>
      <param-value>sa</param-value>
    </parameter>
    <parameter>
      <param-name>password</param-name>
      <param-value></param-value>
    </parameter>
    <parameter>
      <param-name>shutdown</param-name>
      <param-value>true</param-value>
    </parameter>
  </connection>

  <connection name="Directory">
    <adapter-name>LDAP</adapter-name>
    <parameter>
      <param-name>java.naming.provider.url</param-name>
      <param-value>ldap://localhost/</param-value>
    </parameter>
    <parameter>
      <param-name>java.naming.security.principal</param-name>
      <param-value>cn=Manager,dc=my-domain,dc=com</param-value>
    </parameter>
    <parameter>
      <param-name>java.naming.security.credentials</param-name>
      <param-value>secret</param-value>
    </parameter>
  </connection>

</connections>
