<?xml version="1.0" encoding="UTF-8"?>
<!DOCTYPE connections PUBLIC
  "-//Penrose/DTD Connections ${product.specification}//EN"
  "http://penrose.safehaus.org/dtd/connections.dtd">

<connections>

  <connection name="Database">
    <adapter-name>JDBC</adapter-name>
    <parameter>
      <param-name>driver</param-name>
      <param-value>com.mysql.jdbc.Driver</param-value>
    </parameter>
    <parameter>
      <param-name>url</param-name>
      <param-value>jdbc:mysql://localhost/samba?autoReconnect=true</param-value>
    </parameter>
    <parameter>
      <param-name>user</param-name>
      <param-value>penrose</param-value>
    </parameter>
    <parameter>
      <param-name>password</param-name>
      <param-value>penrose</param-value>
    </parameter>
  </connection>
    
</connections>
